text;created_at;source
Feed e storys para redes sociais (Instagram, Facebook, WhatsApp, LinkedIn, Twitter...), cartão de visita interativo, panfletos para supermercados, farmácias etc., todos com seu logotipo e redes sociais. Artes e diagramação em geral. Solicite um post grátis. GRÁFICA DIGITAL. https://t.co/pIxFi94jKk;2022-05-20 21:08:49+00:00;Twitter Web App
Deixe a identificação da sua empresa ou para seu evento moderna e com alta qualidade! - Gráfica Digital São Francisco https://t.co/LcirXP7kuA;2022-05-20 20:12:46+00:00;Twitter Web App
Feed e storys para redes sociais (Instagram, Facebook, WhatsApp, LinkedIn, Twitter...), cartão de visita interativo, panfletos para supermercados, farmácias etc., todos com seu logotipo e redes sociais. Artes e diagramação em geral. Solicite um post grátis. GRÁFICA DIGITAL. https://t.co/kxOICZsAl9;2022-05-20 18:51:27+00:00;Twitter Web App
GRÁFICA UNIPRINTER oferece vaga para Mato Grosso-MTImpressor Digital https://t.co/gwm4py3ArI;2022-05-20 17:43:58+00:00;Infojobs Social
Feed e storys para redes sociais (Instagram, Facebook, WhatsApp, LinkedIn, Twitter...), cartão de visita interativo, panfletos para supermercados, farmácias etc., todos com seu logotipo e redes sociais. Artes e diagramação em geral. Solicite um post grátis. GRÁFICA DIGITAL. https://t.co/DJevSMEA1j;2022-05-20 15:51:04+00:00;Twitter Web App
Feed e storys para redes sociais (Instagram, Facebook, WhatsApp, LinkedIn, Twitter...), cartão de visita interativo, panfletos para supermercados, farmácias etc., todos com seu logotipo e redes sociais. Artes e diagramação em geral. Solicite um post grátis. GRÁFICA DIGITAL. https://t.co/tOC2MUl7J3;2022-05-20 13:47:33+00:00;Twitter Web App
... Meu carimbo qualquer um (infelizmente) vai numa gráfica e replica, mas minha assinatura digital é só minha. A atendente me fez mostrar o cartão do CRM pra ela e assinar DE NOVO a prescrição na frente dela antes de me vender.;2022-05-19 15:46:47+00:00;Twitter for Android
Feed e storys para redes sociais (Instagram, Facebook, WhatsApp, LinkedIn, Twitter...), cartão de visita interativo, panfletos para supermercados, farmácias etc., todos com seu logotipo e redes sociais. Artes e diagramação em geral. Solicite um post grátis. GRÁFICA DIGITAL. https://t.co/2rFSb6MqX6;2022-05-19 13:04:47+00:00;Twitter Web App
Feed e storys para redes sociais (Instagram, Facebook, WhatsApp, LinkedIn, Twitter...), cartão de visita interativo, panfletos para supermercados, farmácias etc., todos com seu logotipo e redes sociais. Artes e diagramação em geral. GRÁFICA DIGITAL. https://t.co/JJTGo0Hryx;2022-05-18 22:36:48+00:00;Twitter Web App
"Dicas de presente pra me dar hoje sem gastar nada 

- Fazer uma redação sobre relativismo cultural 
- Fazer uma prova sobre imagem gráfica digital 

Quem vem";2022-05-18 19:16:43+00:00;Twitter for iPhone
"Heidelberg realiza amanhã (19/5) evento digital e tecnológico para a indústria gráfica, o Prinect User Days 2022
Inscreva-se gratuitamente!
https://t.co/lJ5FGBp6dl https://t.co/iXEqBLNV0n";2022-05-18 16:34:40+00:00;Twitter Web App
Feed e storys para redes sociais (Instagram, Facebook, WhatsApp, LinkedIn, Twitter...), cartão de visita interativo, panfletos para supermercados, farmácias etc., todos com seu logotipo e redes sociais. Artes e diagramação em geral. GRÁFICA DIGITAL. https://t.co/MzTqxzXnnA;2022-05-18 15:18:17+00:00;Twitter Web App
Feed e storys para redes sociais (Instagram, Facebook, WhatsApp, LinkedIn, Twitter...), cartão de visita interativo, panfletos para supermercados, farmácias etc., todos com seu logotipo e redes sociais. Artes e diagramação em geral. GRÁFICA DIGITAL. https://t.co/VUBBRvRdKl;2022-05-18 13:45:19+00:00;Twitter Web App
Interessados podem inscrever trabalhos nas categorias Imprensa Gráfica, Imprensa Digital e Imprensa Multimídia. É permitida a inscrição de apenas uma reportagem por categoria, que deve ter sido publicada entre 28 de agosto de 2021 e 9 de agosto de 2022. https://t.co/FayZZKfG5E;2022-05-18 00:00:01+00:00;TweetDeck
RT @AlexiiaArt: @itsdreexie Alexia, designer gráfica e desenhista, ultimamente estou mais no digital, esses foram meus draws recentes hehe…;2022-05-17 22:55:19+00:00;Twitter Web App
RT @AlexiiaArt: @IcarusArtista Hoi, me achamo Alexia, sou Designer Gráfica e desenhista, fazia muito tradicional, atualmente cá estou em no…;2022-05-17 20:05:21+00:00;Twitter for Android
"@IcarusArtista Hoi, me achamo Alexia, sou Designer Gráfica e desenhista, fazia muito tradicional, atualmente cá estou em no digital, gosto do estilo anime/game, gosto de desenhar coisas fofas e darks tbm kkkkk  bem fan de pokemon também xD. 
meu insta 
https://t.co/TLu3Tdmxhx https://t.co/T29KiCx39K";2022-05-17 19:45:55+00:00;Twitter Web App
"a cada dia que passa, há pelo menos 2 anos, eu percebo que não quero mais trabalhar com gráfica/impressos/festa/decoradores/grandes formatos... me encontrei no digital!

quero paz e sossego e isso só é possivel estando longe das pessoas que cercam esse ramo.";2022-05-17 13:12:52+00:00;Twitter Web App
@clarionrox @TZMporra @2Casa11 @DarioFerrarij @muitoalemck @vickrongo @moan_zero @_caliman @ConfederacaoS @gigi_dutra @FrancisBlacKn @ancaploide @COMUNADEPARlS @Srpobretao @joaodorojao @AlexandreFenel1 @anay_rchist @Ana84450795 @ancapnordestino @popoukitty @de_werlang @WyattTorch @VisVoluntary @remixdextrogiro @anarcanudos @Anarco_Daoista @WonderOfYou1 @fuckhaos @acredomina @EstatismoLibert @papaleguasancap @Nato_Pajeu @brunorm360 @BornToRebellion Claro q não, preço é analise tecnica/gráfica entre outras. Fundamento é a utilidade do ativo. No Caso do BTC é muito complicar ver isso pois ele não é como uma empresa que tem lucros ou um caixa ali, é só um ativo digital escasso. Mas as características que tentam sanar a demanda;2022-05-17 11:30:18+00:00;Twitter for Android
@itsdreexie Alexia, designer gráfica e desenhista, ultimamente estou mais no digital, esses foram meus draws recentes hehe espero que gostem https://t.co/9wHSKmCRyz;2022-05-17 02:32:28+00:00;Twitter for Android
"@BBMangas Para eu ir para o digital o preço tem que fazer valer, afinal se a alegação do valor absurdo é o custo de papel e gráfica por que a versão digital sai tão cara?
Só ver a jbc que acredito eu ser a que mais lança nesse formato.
Metade do valor de uma edição física, acho caro!
+";2022-05-16 22:28:43+00:00;Twitter for Android
"Lembrando: o material é em PDF são 322 páginas e você receberá por e-mail após o comprovante

VOCÊ PODE USAR O MATERIAL DIGITAL OU IR ATÉ UMA GRÁFICA FAZER A IMPRESSÃO ❤️🤩";2022-05-16 20:46:30+00:00;Twitter for iPhone
Feed e storys para redes sociais (Instagram, Facebook, WhatsApp, LinkedIn, Twitter...), cartão de visita interativo, panfletos para supermercados, farmácias etc., todos com seu logotipo e redes sociais. Artes e diagramação em geral. GRÁFICA DIGITAL. https://t.co/6el4FnksWO;2022-05-16 13:00:14+00:00;Twitter Web App
"Criart Digital

@criartdigitalirati

Comunicação visual e gráfica completa.
Nós temos a solução que a sua empresa precisa.
(42) 3423-2063 - 99800-2295 (whatsapp)

#comunicaçãovisual #adesivo #cortepersonalizado #3m #graficadigital #impressaodigital #grafica #cartaofidelidade https://t.co/q3K4OEj6ZY";2022-05-16 11:02:20+00:00;Etus Brasil
"RT @ranoya: Arqueologia digital.
Ferramentas de produção gráfica do final da década de 80 e começo da década de 90.

É como encontrar uma c…";2022-05-16 10:52:23+00:00;Twitter Web App
"RT @ranoya: Arqueologia digital.
Ferramentas de produção gráfica do final da década de 80 e começo da década de 90.

É como encontrar uma c…";2022-05-16 10:35:26+00:00;Twitter for Android
